1,The new application is littered with AI,BUGREPORT,All I see is AI generated posting,CLOSED,0,0,2025-05-13T20:41:19.917931400
2,Subscription,SUPPORT,I need a better deal or subscription. This one is out of my budget.,CLOSED,1,1,2025-05-13T20:41:19.917931400
3,Missing Parcel,SUPPORT,I didn't receive my parcel last week,CLOSED,1,0,2025-05-13T20:41:19.917931400
4,Locked Account,BUGREPORT,My account is said to be unreachable.,CLOSED,1,0,2025-05-13T20:41:19.917931400
5,BSOD ,BUGREPORT,My client is causing me blue screens,CLOSED,0,1,2025-05-13T20:41:19.917931400
6,Message,BUGREPORT,I can't send messages,CLOSED,0,1,2025-05-14T00:49:23.483229300
